{
  "$schema": "https://json-schema.org/draft/2020-12/schema",
  "$id": "https://ledgerops.dev/contracts/v1/MessageEnvelope.schema.json",
  "title": "LedgerOps message envelope version 1",
  "type": "object",
  "additionalProperties": false,
  "required": [
    "messageId",
    "messageType",
    "schemaVersion",
    "aggregateId",
    "tenantId",
    "correlationId",
    "causationId",
    "occurredAt",
    "payload"
  ],
  "properties": {
    "messageId": { "type": "string", "format": "uuid" },
    "messageType": { "type": "string", "minLength": 1 },
    "schemaVersion": { "const": 1 },
    "aggregateId": { "type": "string", "format": "uuid" },
    "tenantId": { "type": "string", "format": "uuid" },
    "correlationId": { "type": "string", "format": "uuid" },
    "causationId": { "type": "string", "format": "uuid" },
    "occurredAt": { "type": "string", "format": "date-time" },
    "payload": { "type": "object" }
  }
}
