{
  "messageId": "00000000-0000-0000-0000-000000000011",
  "messageType": "SubmitPaymentToProvider",
  "schemaVersion": 1,
  "aggregateId": "00000000-0000-0000-0000-000000000001",
  "tenantId": "00000000-0000-0000-0000-000000000002",
  "correlationId": "00000000-0000-0000-0000-000000000003",
  "causationId": "00000000-0000-0000-0000-000000000004",
  "occurredAt": "2026-07-21T12:00:00Z",
  "payload": {
    "attemptId": "00000000-0000-0000-0000-000000000010"
  }
}
